title,description,type,expires_at
"Id impedit.","Et quis reprehenderit libero ea similique mollitia omnis.",sell,"2024-03-13 16:00:29"
"Id quidem.","Odit dolores et ut error.",sell,"2024-03-15 08:27:11"
Nostrum.,"Consequuntur aut et quia ut.",sell,"2024-03-14 07:32:23"
Ea.,"Ipsum enim aspernatur a nulla soluta. Et unde necessitatibus est est iusto nisi culpa.",sell,"2024-03-14 08:15:22"
Doloremque.,"Cum consequuntur et qui quia nihil quia rerum. Officiis molestias enim nam est nam esse in.",sell,"2024-03-15 04:37:21"
Ut.,"Aliquam tenetur possimus nihil porro fugiat ea. Consequatur quos itaque occaecati quam eum ratione autem.",rent,"2024-03-15 02:51:17"
"Placeat enim.","Maiores dicta et deleniti nostrum qui quae. Ut assumenda corrupti omnis.",rent,"2024-03-14 19:09:01"
Eum.,"Qui tempora asperiores id ut placeat.",sell,"2024-03-14 19:32:32"
Voluptates.,"Ut corporis aperiam nam quia dolorum laudantium. Cumque voluptatem animi hic harum cupiditate adipisci.",rent,"2024-03-15 00:56:34"
Aspernatur.,"Est maiores sint neque voluptatibus non. Aut omnis non rerum.",rent,"2024-03-13 20:12:58"
Voluptates.,"Quibusdam minus ratione dicta distinctio odit. Reprehenderit voluptatum consequatur similique.",rent,"2024-03-15 07:09:34"
Ab.,"Ea dolorum nostrum est deserunt.",rent,"2024-03-14 01:16:44"
"Sed saepe.","Et et sit id non sit ipsam. Eveniet cupiditate qui blanditiis voluptatibus magni enim eum.",rent,"2024-03-14 03:12:15"
Id.,"Vitae aliquid eaque omnis quidem aut sit. Eligendi tempore possimus sit facere soluta aut.",rent,"2024-03-14 11:12:13"
Quod.,"Omnis sed eveniet ad qui. Illum necessitatibus aut possimus deserunt.",rent,"2024-03-14 14:05:10"
"Quia et.","Consequuntur reprehenderit amet rem voluptatem similique debitis.",sell,"2024-03-13 21:35:05"
"Molestiae fugit.","Laborum ea inventore nisi dolorum debitis.",rent,"2024-03-14 10:31:08"
"Eum alias.","Ducimus et esse eum ab. Officia repellendus ut autem rerum temporibus quod.",sell,"2024-03-15 02:56:53"
Ullam.,"Eum et reiciendis consequuntur veritatis ea voluptatem.",sell,"2024-03-14 19:30:30"
Exercitationem.,"Enim suscipit ex expedita culpa.",rent,"2024-03-13 21:05:59"
Ex.,"Veritatis eos minima unde nostrum fuga. Quia omnis neque quisquam qui unde cumque.",rent,"2024-03-14 01:54:57"
"Rerum expedita.","Quisquam quia temporibus voluptates ut voluptatem voluptate blanditiis.",sell,"2024-03-13 22:10:50"
"Est sint.","Cum ea suscipit sed hic architecto. Optio voluptatem et enim nostrum.",sell,"2024-03-14 09:19:56"
Commodi.,"A accusantium provident aut laboriosam nemo.",rent,"2024-03-14 21:55:26"
Minima.,"Ea nam qui qui nihil ratione. Cumque omnis qui rerum repellendus voluptatem aut soluta.",rent,"2024-03-14 22:36:43"
"Excepturi perferendis.","Voluptatem eligendi libero magnam fuga.",sell,"2024-03-14 16:45:03"
Omnis.,"Delectus exercitationem magnam in facere doloribus sit. A voluptatibus distinctio et vel hic.",sell,"2024-03-15 08:14:03"
Enim.,"Numquam sit minima sed dolor. Sint qui non error voluptas ab nobis dolorem.",sell,"2024-03-14 17:26:09"
"Quaerat qui.","Qui consequatur dolores minus architecto et sunt. Sequi sunt ipsum dignissimos rerum voluptatem.",rent,"2024-03-13 22:47:39"
"Voluptatem dolorum.","Ut culpa minima sed eius sed eos sed.",sell,"2024-03-13 22:33:38"
Quia.,"Et officiis dolorem quidem quia. Cumque mollitia molestiae similique omnis.",rent,"2024-03-15 05:14:03"
"Autem quas.","Nisi quas rerum omnis culpa. Sed quia omnis sit aut ad.",rent,"2024-03-14 09:36:20"
Ad.,"Repellendus qui ut vel molestiae quis eaque. Cupiditate quia necessitatibus consequatur temporibus perferendis occaecati laudantium.",rent,"2024-03-14 19:19:57"
"Nemo laborum.","Aperiam dolores expedita et aliquid distinctio et non. Sed sed corrupti error porro voluptatum.",rent,"2024-03-13 14:06:03"
"Voluptatem odio.","A reprehenderit voluptatem ratione qui. Doloribus voluptas rem voluptatum eius esse eos.",sell,"2024-03-15 03:55:54"
Necessitatibus.,"Consectetur amet laboriosam voluptatibus reiciendis.",rent,"2024-03-14 01:35:45"
Ut.,"Deserunt quibusdam enim in dignissimos consequatur quibusdam.",sell,"2024-03-14 15:26:43"
Repellendus.,"Voluptas animi quaerat quibusdam dolore.",sell,"2024-03-13 22:24:42"
"Non neque.","Dolorum quis aliquid facere dolor vitae vitae.",rent,"2024-03-15 00:43:05"
"Ea nemo.","At rerum nisi molestiae laborum veniam non molestias.",sell,"2024-03-13 23:28:17"
Reprehenderit.,"Sed quis natus temporibus sed in omnis. Magni quos rerum omnis et cumque soluta saepe.",sell,"2024-03-14 22:38:53"
"Corrupti inventore.","Libero voluptates sit facilis sit perferendis veniam minima. Quae voluptas ipsam labore qui dolorum.",rent,"2024-03-14 17:28:30"
Ut.,"Sapiente laborum est debitis ab quasi aut eum. Dignissimos officia ut dignissimos dolorem rerum libero ipsa.",sell,"2024-03-14 15:07:46"
Quisquam.,"Aperiam voluptatum et officia minus quidem id voluptates.",sell,"2024-03-13 14:57:22"
Tempora.,"Vero sit et ipsum unde quos magnam.",sell,"2024-03-15 13:08:49"
"Optio dolores.","Ad culpa et dolorum qui recusandae aliquam. Harum ipsam aliquid qui ut vel aut iste.",sell,"2024-03-15 04:00:09"
"Quia nulla.","Dicta earum sed omnis natus. Rerum non nihil aut et dolorem expedita.",rent,"2024-03-15 12:45:19"
Architecto.,"Fugit nihil impedit vero cupiditate molestiae consequuntur dolores. Eum sed ut sapiente maxime facere vel culpa aut.",sell,"2024-03-13 20:46:19"
"Qui sed.","Autem officiis veritatis eum dolore sed est.",sell,"2024-03-13 21:50:19"
"Repellat corrupti.","Consequatur assumenda possimus ex a. Velit incidunt iure enim tenetur ducimus corporis vel.",rent,"2024-03-14 16:07:54"
"Molestias voluptatem.","Ipsa animi dolores nam odit maxime. Veniam quam unde quaerat optio nihil voluptates nostrum deserunt.",sell,"2024-03-15 08:06:43"
Quaerat.,"Qui iusto ut hic nisi eligendi. Tenetur repellat magnam cupiditate qui.",rent,"2024-03-14 20:32:34"
Sint.,"Dolore est omnis fugiat animi sint in. Consequatur architecto id tenetur voluptatem.",rent,"2024-03-15 03:55:50"
"Architecto quia.","Ut est adipisci voluptatem commodi molestias impedit.",sell,"2024-03-13 15:13:47"
Repellat.,"Exercitationem in omnis sed totam hic. Voluptas sed magnam veniam eum omnis animi.",sell,"2024-03-14 04:37:06"
Velit.,"Dolor impedit saepe sit vitae.",sell,"2024-03-15 01:29:56"
"Mollitia ut.","Ut dolores id aliquam minus. Animi ut temporibus est et.",rent,"2024-03-14 03:46:28"
"Ut consequatur.","Quod consequatur facilis nisi numquam eligendi cumque.",rent,"2024-03-15 06:01:29"
Sint.,"Occaecati et porro deserunt quis ullam.",rent,"2024-03-13 22:41:41"
A.,"Adipisci repudiandae dolore deserunt quos accusantium dolor.",rent,"2024-03-14 14:02:29"
"Perspiciatis possimus.","Consequatur aut dolorem cupiditate omnis a sed voluptate.",sell,"2024-03-14 12:29:10"
Qui.,"Tenetur et tempore omnis est rem et.",sell,"2024-03-15 05:33:58"
"Suscipit rerum.","Quia qui aliquam beatae ut voluptatum ex non. Et sed debitis dolorem incidunt.",sell,"2024-03-14 06:55:05"
"Enim aliquam.","Et ullam a amet rerum. Et velit est ratione eos consequuntur culpa.",sell,"2024-03-15 09:08:13"
